{
  "registryId": "logsense-entity-type-registry",
  "version": "0.1.0",
  "entries": [
    {
      "entityType": "HUMAN_PRINCIPAL",
      "parentCategory": "HUMAN_PRINCIPAL",
      "joinCompatibilityGroup": "HUMAN_PRINCIPAL",
      "identityComponents": [
        "provider",
        "environment",
        "domain",
        "namespace",
        "externalId",
        "instanceId"
      ],
      "requiredExactKeys": [
        "externalId"
      ],
      "allowedAliasKeys": [
        "externalId"
      ],
      "instanceScoped": false,
      "haiecTargetType": null,
      "localOnly": true,
      "notes": []
    },
    {
      "entityType": "SERVICE_PRINCIPAL",
      "parentCategory": "SERVICE_PRINCIPAL",
      "joinCompatibilityGroup": "SERVICE_PRINCIPAL",
      "identityComponents": [
        "provider",
        "environment",
        "domain",
        "namespace",
        "externalId",
        "instanceId"
      ],
      "requiredExactKeys": [
        "externalId"
      ],
      "allowedAliasKeys": [
        "externalId"
      ],
      "instanceScoped": false,
      "haiecTargetType": null,
      "localOnly": true,
      "notes": []
    },
    {
      "entityType": "ORGANIZATION",
      "parentCategory": "ORGANIZATION",
      "joinCompatibilityGroup": "ORGANIZATION",
      "identityComponents": [
        "provider",
        "environment",
        "domain",
        "namespace",
        "externalId",
        "instanceId"
      ],
      "requiredExactKeys": [
        "externalId"
      ],
      "allowedAliasKeys": [
        "externalId"
      ],
      "instanceScoped": false,
      "haiecTargetType": null,
      "localOnly": true,
      "notes": []
    },
    {
      "entityType": "AI_SYSTEM",
      "parentCategory": "AI_SYSTEM",
      "joinCompatibilityGroup": "AI_SYSTEM",
      "identityComponents": [
        "provider",
        "environment",
        "domain",
        "namespace",
        "externalId",
        "instanceId"
      ],
      "requiredExactKeys": [
        "externalId"
      ],
      "allowedAliasKeys": [
        "externalId"
      ],
      "instanceScoped": false,
      "haiecTargetType": "AI_SYSTEM",
      "localOnly": false,
      "notes": []
    },
    {
      "entityType": "AI_AGENT",
      "parentCategory": "AI_AGENT",
      "joinCompatibilityGroup": "AI_AGENT",
      "identityComponents": [
        "provider",
        "environment",
        "domain",
        "namespace",
        "externalId",
        "instanceId"
      ],
      "requiredExactKeys": [
        "externalId"
      ],
      "allowedAliasKeys": [
        "externalId"
      ],
      "instanceScoped": false,
      "haiecTargetType": null,
      "localOnly": true,
      "notes": []
    },
    {
      "entityType": "AGENT_INSTANCE",
      "parentCategory": "AGENT_INSTANCE",
      "joinCompatibilityGroup": "AGENT_INSTANCE",
      "identityComponents": [
        "provider",
        "environment",
        "domain",
        "namespace",
        "externalId",
        "instanceId"
      ],
      "requiredExactKeys": [
        "externalId"
      ],
      "allowedAliasKeys": [
        "externalId"
      ],
      "instanceScoped": true,
      "haiecTargetType": null,
      "localOnly": true,
      "notes": []
    },
    {
      "entityType": "MODEL",
      "parentCategory": "MODEL",
      "joinCompatibilityGroup": "MODEL",
      "identityComponents": [
        "provider",
        "environment",
        "domain",
        "namespace",
        "externalId",
        "instanceId"
      ],
      "requiredExactKeys": [
        "externalId"
      ],
      "allowedAliasKeys": [
        "externalId"
      ],
      "instanceScoped": false,
      "haiecTargetType": null,
      "localOnly": true,
      "notes": []
    },
    {
      "entityType": "WORKFLOW",
      "parentCategory": "WORKFLOW",
      "joinCompatibilityGroup": "WORKFLOW",
      "identityComponents": [
        "provider",
        "environment",
        "domain",
        "namespace",
        "externalId",
        "instanceId"
      ],
      "requiredExactKeys": [
        "externalId"
      ],
      "allowedAliasKeys": [
        "externalId"
      ],
      "instanceScoped": false,
      "haiecTargetType": null,
      "localOnly": true,
      "notes": []
    },
    {
      "entityType": "TASK",
      "parentCategory": "TASK",
      "joinCompatibilityGroup": "TASK",
      "identityComponents": [
        "provider",
        "environment",
        "domain",
        "namespace",
        "externalId",
        "instanceId"
      ],
      "requiredExactKeys": [
        "externalId"
      ],
      "allowedAliasKeys": [
        "externalId"
      ],
      "instanceScoped": false,
      "haiecTargetType": null,
      "localOnly": true,
      "notes": []
    },
    {
      "entityType": "INTENT",
      "parentCategory": "INTENT",
      "joinCompatibilityGroup": "INTENT",
      "identityComponents": [
        "provider",
        "environment",
        "domain",
        "namespace",
        "externalId",
        "instanceId"
      ],
      "requiredExactKeys": [
        "externalId"
      ],
      "allowedAliasKeys": [
        "externalId"
      ],
      "instanceScoped": false,
      "haiecTargetType": "INTENT",
      "localOnly": false,
      "notes": []
    },
    {
      "entityType": "GOAL",
      "parentCategory": "GOAL",
      "joinCompatibilityGroup": "GOAL",
      "identityComponents": [
        "provider",
        "environment",
        "domain",
        "namespace",
        "externalId",
        "instanceId"
      ],
      "requiredExactKeys": [
        "externalId"
      ],
      "allowedAliasKeys": [
        "externalId"
      ],
      "instanceScoped": false,
      "haiecTargetType": null,
      "localOnly": true,
      "notes": []
    },
    {
      "entityType": "MESSAGE",
      "parentCategory": "MESSAGE",
      "joinCompatibilityGroup": "MESSAGE",
      "identityComponents": [
        "provider",
        "environment",
        "domain",
        "namespace",
        "externalId",
        "instanceId"
      ],
      "requiredExactKeys": [],
      "allowedAliasKeys": [
        "externalId"
      ],
      "instanceScoped": false,
      "haiecTargetType": null,
      "localOnly": true,
      "notes": []
    },
    {
      "entityType": "PROMPT",
      "parentCategory": "PROMPT",
      "joinCompatibilityGroup": "PROMPT",
      "identityComponents": [
        "provider",
        "environment",
        "domain",
        "namespace",
        "externalId",
        "instanceId"
      ],
      "requiredExactKeys": [],
      "allowedAliasKeys": [
        "externalId"
      ],
      "instanceScoped": false,
      "haiecTargetType": null,
      "localOnly": true,
      "notes": []
    },
    {
      "entityType": "CONTEXT",
      "parentCategory": "CONTEXT",
      "joinCompatibilityGroup": "CONTEXT",
      "identityComponents": [
        "provider",
        "environment",
        "domain",
        "namespace",
        "externalId",
        "instanceId"
      ],
      "requiredExactKeys": [],
      "allowedAliasKeys": [
        "externalId"
      ],
      "instanceScoped": false,
      "haiecTargetType": null,
      "localOnly": true,
      "notes": []
    },
    {
      "entityType": "MEMORY_STORE",
      "parentCategory": "MEMORY_STORE",
      "joinCompatibilityGroup": "MEMORY_STORE",
      "identityComponents": [
        "provider",
        "environment",
        "domain",
        "namespace",
        "externalId",
        "instanceId"
      ],
      "requiredExactKeys": [
        "externalId"
      ],
      "allowedAliasKeys": [
        "externalId"
      ],
      "instanceScoped": false,
      "haiecTargetType": null,
      "localOnly": true,
      "notes": []
    },
    {
      "entityType": "MEMORY_ENTRY",
      "parentCategory": "MEMORY_ENTRY",
      "joinCompatibilityGroup": "MEMORY_ENTRY",
      "identityComponents": [
        "provider",
        "environment",
        "domain",
        "namespace",
        "externalId",
        "instanceId"
      ],
      "requiredExactKeys": [
        "externalId"
      ],
      "allowedAliasKeys": [
        "externalId"
      ],
      "instanceScoped": false,
      "haiecTargetType": null,
      "localOnly": true,
      "notes": []
    },
    {
      "entityType": "RETRIEVAL_QUERY",
      "parentCategory": "RETRIEVAL_QUERY",
      "joinCompatibilityGroup": "RETRIEVAL_QUERY",
      "identityComponents": [
        "provider",
        "environment",
        "domain",
        "namespace",
        "externalId",
        "instanceId"
      ],
      "requiredExactKeys": [
        "externalId"
      ],
      "allowedAliasKeys": [
        "externalId"
      ],
      "instanceScoped": false,
      "haiecTargetType": null,
      "localOnly": true,
      "notes": []
    },
    {
      "entityType": "KNOWLEDGE_SOURCE",
      "parentCategory": "KNOWLEDGE_SOURCE",
      "joinCompatibilityGroup": "KNOWLEDGE_SOURCE",
      "identityComponents": [
        "provider",
        "environment",
        "domain",
        "namespace",
        "externalId",
        "instanceId"
      ],
      "requiredExactKeys": [
        "externalId"
      ],
      "allowedAliasKeys": [
        "externalId"
      ],
      "instanceScoped": false,
      "haiecTargetType": null,
      "localOnly": true,
      "notes": []
    },
    {
      "entityType": "RETRIEVED_DOCUMENT",
      "parentCategory": "RETRIEVED_DOCUMENT",
      "joinCompatibilityGroup": "RETRIEVED_DOCUMENT",
      "identityComponents": [
        "provider",
        "environment",
        "domain",
        "namespace",
        "externalId",
        "instanceId"
      ],
      "requiredExactKeys": [
        "externalId"
      ],
      "allowedAliasKeys": [
        "externalId"
      ],
      "instanceScoped": false,
      "haiecTargetType": null,
      "localOnly": true,
      "notes": []
    },
    {
      "entityType": "TOOL",
      "parentCategory": "TOOL",
      "joinCompatibilityGroup": "TOOL",
      "identityComponents": [